{
  "schemaVersion": "allmath-knowledge-corpus/v1",
  "corpusId": "corpus:local:pi-digits:ultrapi-status-normalization:v1",
  "rootId": "local:pi-digits",
  "title": "UltraPi canonical conjecture and experiment status normalization",
  "pathsRelativeTo": "../..",
  "canonicalSource": {
    "path": "ultrapi.md",
    "sha256": "49299073e53c3949ab77f5d9bdb97cd89cd8b24d5c4cbad5f5c97c00121f22fc"
  },
  "externalNodeIds": [
    "claim:local:pi-digits:ultrapi:t72",
    "claim:local:pi-digits:ultrapi:t75",
    "result:local:pi-digits:ultrapi:bbp-endpoint-e16-experiment-20260813-189a0529d4"
  ],
  "records": [
    {
      "id": "claim:local:pi-digits:ultrapi:v1-every-finite-decimal-word-occurs",
      "kind": "claim",
      "title": "Every finite decimal word occurs in pi",
      "statement": "Every finite decimal word occurs somewhere in the decimal expansion of pi.",
      "claimLevel": "conjecture",
      "scope": {
        "name": "V1",
        "base": 10,
        "constant": "pi",
        "quantifiers": "for every finite decimal word, there exists an occurrence"
      },
      "sources": [
        {
          "path": "ultrapi.md",
          "sha256": "49299073e53c3949ab77f5d9bdb97cd89cd8b24d5c4cbad5f5c97c00121f22fc",
          "kind": "note",
          "role": "current-status-dossier"
        },
        {
          "path": "problems/local/pi-digits.txt",
          "sha256": "2bc65e79437f07eac1a31e7815b5ad738b1099884262880d42c6ded2b8f9a825",
          "kind": "primary-source",
          "role": "canonical-statement"
        }
      ]
    },
    {
      "id": "claim:local:pi-digits:ultrapi:bbp-endpoint-gap-law",
      "kind": "claim",
      "title": "Uniform BBP endpoint-gap law",
      "statement": "For the genuine pre-drop and first-drop BBP phase rows, the largest circular gap satisfies G_e^plus,G_e^minus = O(log L_e / L_e) uniformly along the required epochs.",
      "claimLevel": "conjecture",
      "scope": {
        "route": "BBP uniform shadow cover",
        "role": "directly sufficient analytic premise",
        "doesNotAssert": "V1 without the other T75 premises"
      },
      "sources": [
        {
          "path": "ultrapi.md",
          "sha256": "49299073e53c3949ab77f5d9bdb97cd89cd8b24d5c4cbad5f5c97c00121f22fc",
          "kind": "note",
          "role": "conjecture-statement"
        },
        {
          "path": "work/ultrapi-resume/bbp_endpoint_e16_experiment_20260813.md",
          "sha256": "b9dfc7682b525afae6d70379982f6503962dfce55389c4b0d2a8efb87505c9aa",
          "kind": "note",
          "role": "bounded-motivation"
        }
      ]
    },
    {
      "id": "result:local:pi-digits:ultrapi:bbp-endpoint-e16-bounded-experiment",
      "kind": "result",
      "title": "Bounded exact BBP endpoint phase experiment through epoch 16",
      "statement": "Fourteen audited pre-drop and first-drop rows through even epoch 16 satisfy the recorded finite normalized-gap bounds; this bounded computation proves neither the endpoint-gap law nor V1.",
      "claimLevel": "experiment",
      "scope": {
        "epochs": "even e=4 through 16",
        "bounded": true,
        "asymptoticClaim": false
      },
      "sources": [
        {
          "path": "work/ultrapi-resume/bbp_endpoint_e16_experiment_20260813.md",
          "sha256": "b9dfc7682b525afae6d70379982f6503962dfce55389c4b0d2a8efb87505c9aa",
          "kind": "note",
          "role": "primary-report"
        },
        {
          "path": "work/ultrapi-resume/bbp_endpoint_e16_experiment_20260813.py",
          "sha256": "d9fc5d4f8bff417bb50812788c0f893a03d9c02c343b1a031f69b390a2320e13",
          "kind": "test",
          "role": "replay"
        },
        {
          "path": "work/ultrapi-resume/bbp_endpoint_e16_experiment_20260813_record.txt",
          "sha256": "2a9b25378bdf0a0a7a8d796c76c5e7058932876bb0a8004f21322d792edf982d",
          "kind": "dataset",
          "role": "finite-record"
        },
        {
          "path": "work/ultrapi-resume/bbp_endpoint_e16_experiment_20260813_independent_audit.md",
          "sha256": "a17ea0268bd7f824b0344c167142864c7f6e4948e65ee56858d3bdf4479b83d9",
          "kind": "note",
          "role": "independent-audit"
        },
        {
          "path": "work/ultrapi-resume/bbp_endpoint_e16_experiment_20260813_independent_check.py",
          "sha256": "332c9bcaae58d626a0aa5614f5a5f928b2be9245532241ec6061d4d0e7fb46db",
          "kind": "test",
          "role": "independent-replay"
        }
      ]
    }
  ],
  "edges": [
    {
      "from": "claim:local:pi-digits:ultrapi:v1-every-finite-decimal-word-occurs",
      "to": "claim:local:pi-digits:ultrapi:t72",
      "relation": "related"
    },
    {
      "from": "claim:local:pi-digits:ultrapi:bbp-endpoint-gap-law",
      "to": "claim:local:pi-digits:ultrapi:t75",
      "relation": "related"
    },
    {
      "from": "result:local:pi-digits:ultrapi:bbp-endpoint-e16-bounded-experiment",
      "to": "claim:local:pi-digits:ultrapi:bbp-endpoint-gap-law",
      "relation": "supports"
    },
    {
      "from": "result:local:pi-digits:ultrapi:bbp-endpoint-e16-bounded-experiment",
      "to": "result:local:pi-digits:ultrapi:bbp-endpoint-e16-experiment-20260813-189a0529d4",
      "relation": "supersedes"
    }
  ]
}
