{
  "schemaVersion": "allmath-knowledge-corpus/v1",
  "corpusId": "corpus:local:pi-digits:ultrapi-reconciliation:v1",
  "rootId": "local:pi-digits",
  "title": "UltraPi graph reconciliation and scope boundary",
  "pathsRelativeTo": "../..",
  "canonicalSource": {
    "path": "ultrapi.md",
    "sha256": "49299073e53c3949ab77f5d9bdb97cd89cd8b24d5c4cbad5f5c97c00121f22fc"
  },
  "externalNodeIds": [
    "claim:local:pi-digits:ultrapi:t72",
    "claim:local:pi-digits:ultrapi:t77",
    "corpus:local:pi-digits:ultrapi:v1",
    "mechanism:local:pi-digits:ultrapi:bbp",
    "result:local:pi-digits:ultrapi:bbp-colored-zero-carry-v1-20260813-222f278fbe",
    "result:local:pi-digits:ultrapi:bbp-rational-phase-density-separator-20260813-b6a2d61171",
    "result:local:pi-digits:bbp-rational-phase-density-separator-20260813",
    "result:local:pi-digits:colored-zero-carry-v1-equivalence-20260813"
  ],
  "records": [
    {
      "id": "result:local:pi-digits:bbp-rational-phase-density-separator-20260813",
      "kind": "result",
      "title": "BBP rational-phase density separator",
      "statement": "proof sketch: exact-denominator and density-one-exact near-BBP rational phase separators have zero centered carries; this does not prove positive carry density or V1",
      "claimLevel": "proof sketch",
      "scope": {
        "program": "UltraPi",
        "reconciliation": "pre-existing canonical graph node"
      },
      "sources": [
        {
          "path": "work/ultrapi-resume/bbp_rational_phase_density_separator_20260813.md",
          "sha256": "1fa0054d89852630c573ad9eee5bd5ae59a442b34809343f7ca9bb7dc1fbc198",
          "kind": "note",
          "role": "primary-report"
        },
        {
          "path": "work/ultrapi-resume/bbp_rational_phase_density_separator_20260813_check.py",
          "sha256": "72dfd913b3532bfe41e1df9a87ebbb3000f6fe1d179af4edbc0163d2a36cc3bc",
          "kind": "test",
          "role": "replay"
        },
        {
          "path": "work/ultrapi-resume/bbp_rational_phase_density_separator_20260813_independent_audit.md",
          "sha256": "52589a8caa68224b41331c265462f894daf80770c88b8b0861339bf25ecb01dd",
          "kind": "note",
          "role": "independent-audit"
        },
        {
          "path": "work/ultrapi-resume/bbp_rational_phase_density_separator_20260813_independent_check.py",
          "sha256": "2d55e4abb1a92860a44798c07c970ea2831c33f98ff056ae721cae11f3386ea2",
          "kind": "test",
          "role": "independent-replay"
        },
        {
          "path": "work/ultrapi-resume/bbp_rational_phase_density_separator_20260813_second_independent_audit.md",
          "sha256": "03c8ccd1f9905d0ae7cfb4627adc576de114a8227842cf1c6b00a66f1cb74ed0",
          "kind": "note",
          "role": "second-independent-audit"
        },
        {
          "path": "work/ultrapi-resume/bbp_rational_phase_density_separator_20260813_second_independent_check.py",
          "sha256": "7f76b9802318d89e1ae3f825e49049755e645e9d94f2fe730f2916ffeb99f96a",
          "kind": "test",
          "role": "second-independent-replay"
        }
      ]
    },
    {
      "id": "result:local:pi-digits:colored-zero-carry-v1-equivalence-20260813",
      "kind": "result",
      "title": "Colored zero-carry V1 equivalence and BBP phase recurrence",
      "statement": "proof sketch: V1 is equivalent to arbitrarily late arbitrarily long zero-carry blocks in every repunit color; the exact BBP phase recurrence exposes but does not prove this property",
      "claimLevel": "proof sketch",
      "scope": {
        "program": "UltraPi",
        "reconciliation": "pre-existing canonical graph node"
      },
      "sources": [
        {
          "path": "work/ultrapi-resume/bbp_colored_zero_carry_v1_20260813.md",
          "sha256": "159ff0d1c94d9fb145790e0ca4f11db571d0af211ef2c588b094201122ff279a",
          "kind": "note",
          "role": "primary-report"
        },
        {
          "path": "work/ultrapi-resume/bbp_colored_zero_carry_v1_20260813_check.py",
          "sha256": "7fbce9df0a4a92831ce7cadc5c0343546be71dd771331f7b5f7270fd4150d916",
          "kind": "test",
          "role": "replay"
        },
        {
          "path": "work/ultrapi-resume/bbp_colored_zero_carry_v1_20260813_independent_audit.md",
          "sha256": "b750fb9bd3c7ff30316f87ae6e3317ad61dded1c2fb73a9ea8bfbe23abf41048",
          "kind": "note",
          "role": "independent-audit"
        },
        {
          "path": "work/ultrapi-resume/bbp_colored_zero_carry_v1_20260813_independent_check.py",
          "sha256": "46c3b807872b7e483c05e1eabe9c42bb7b4307abf2ff5022b6e4f9e51ed75433",
          "kind": "test",
          "role": "independent-replay"
        }
      ]
    },
    {
      "id": "review:local:pi-digits:ultrapi:stale-integration-memo-20260810",
      "kind": "review",
      "title": "Superseded UltraPi integration memo",
      "statement": "The 2026-08-10 integration memo pins an older UltraPi hash and covers only an earlier result range; the v1 corpus pins the current dossier and supersedes it as an inventory.",
      "claimLevel": null,
      "scope": {
        "oldCoverage": "T18-T70",
        "currentCoverage": "T18-T77 plus linked artifacts"
      },
      "sources": [
        {
          "path": "work/theory/pi-lacunary-near-return-sparsity/ULTRAPI_INTEGRATION_2026-08-10.md",
          "sha256": "3a91d7fa5bec10661c527ee07893ce1d76a2328401102c72df21307ba3704590",
          "kind": "note",
          "role": "superseded-integration-memo"
        },
        {
          "path": "ultrapi.md",
          "sha256": "49299073e53c3949ab77f5d9bdb97cd89cd8b24d5c4cbad5f5c97c00121f22fc",
          "kind": "note",
          "role": "current-canonical-dossier"
        }
      ]
    },
    {
      "id": "decision:local:pi-digits:ultrapi:t78-outside-v1-corpus",
      "kind": "decision",
      "title": "T78 remains an unintegrated draft outside the pinned UltraPi v1 corpus",
      "statement": "The T78 file exists locally but is absent from ultrapi.md, TheoryLib.lean, and the central axiom audit. Its presence is recorded without assigning a mathematical claim level.",
      "claimLevel": null,
      "scope": {
        "includedThrough": "T77",
        "draft": "T78",
        "promotion": "none"
      },
      "sources": [
        {
          "path": "TheoryLib/PiQuantitativeBlockHitting/T78T78SelectedPadicDefectCongruence.lean",
          "sha256": "34191fb86f7b65f3d1fa8e3a27c5769e6ba6253f73ec8cd5dd6c83873efaa56e",
          "kind": "lean-source",
          "role": "unintegrated-draft"
        }
      ]
    }
  ],
  "edges": [
    {
      "from": "result:local:pi-digits:bbp-rational-phase-density-separator-20260813",
      "to": "result:local:pi-digits:ultrapi:bbp-rational-phase-density-separator-20260813-b6a2d61171",
      "relation": "supersedes"
    },
    {
      "from": "result:local:pi-digits:bbp-rational-phase-density-separator-20260813",
      "to": "mechanism:local:pi-digits:ultrapi:bbp",
      "relation": "related"
    },
    {
      "from": "result:local:pi-digits:colored-zero-carry-v1-equivalence-20260813",
      "to": "result:local:pi-digits:ultrapi:bbp-colored-zero-carry-v1-20260813-222f278fbe",
      "relation": "supersedes"
    },
    {
      "from": "result:local:pi-digits:colored-zero-carry-v1-equivalence-20260813",
      "to": "claim:local:pi-digits:ultrapi:t72",
      "relation": "related"
    },
    {
      "from": "corpus:local:pi-digits:ultrapi:v1",
      "to": "review:local:pi-digits:ultrapi:stale-integration-memo-20260810",
      "relation": "supersedes"
    },
    {
      "from": "decision:local:pi-digits:ultrapi:t78-outside-v1-corpus",
      "to": "claim:local:pi-digits:ultrapi:t77",
      "relation": "derived-from"
    }
  ]
}
